店铺ID,店铺名称,销售,收入,创建,发布
500652,武汉华师师源图书有限公司,0,0,0,0
500487,河南文友图书发行有限公司,0,0,0,0
500257,北京王后雄教育科技有限公司,0,0,0,0
500521,四川精志愿教育科技有限公司,0,0,0,0
500655,微课时代（北京）文化传媒有限公司,0,0,0,0
500666,宿迁市宿城区巨鼎教育培训中心有限公司,0,0,0,0
500640,振坤翰苑（北京）图书有限公司,0,0,0,0
500641,无锡市博才培训中心有限公司,0,0,0,0
500575,百年育才（北京）教育咨询集团股份有限公司,0,0,0,0
500455,新疆星润文化传媒有限公司,0,0,0,0
500584,徐州主合教育科技有限公司,0,0,0,0
500669,山东盛博苑图书有限公司,0,0,0,0
500339,山东鼎鑫书业有限公司,14562.96,12653.88,0,1449
500162,郑州荣恒图书发行有限公司,21621.59,15134.74,101,2277
500161,西安玖典文创科技有限公司,2467.7,1727.39,0,18
500313,山东瀚海书韵教育科技有限公司,305,213.5,0,0
500345,广州翰庭文化传媒有限公司,99.4,69.58,0,0
500297,河南文轩文化传播有限公司,208.2,145.74,0,0
500254,成都康达书业有限公司,52.4,36.68,0,0
500372,广州百试乐文化教育有限公司,26.2,18.34,0,0
500393,湖北海韵文化传媒有限公司,10,7,0,0
500425,昆明书屯文化传播有限公司,5.5,3.85,0,0
500694,重庆智琅图书有限公司两江新区分公司,3,2.1,0,0
500302,河北艾玛文化发展有限公司,2,1.4,0,0
500320,梁山县文轩图书有限公司,2,1.4,0,0
500368,武汉乐学天成文化传播有限公司,13,9.1,0,0
500319,山东志鸿超仁图书有限公司,11,7.7,0,0
500262,广东易杰教育研究有限公司,15,10.5,0,0
500315,山东学苑文化传媒有限责任公司,0,0,0,0
500172,陕西灰犀牛图书策划有限公司,40097.46,28067.98,7,440
500376,江西宇恒文化发展有限公司,10462.28,7323.59,29,447
500173,河北金卷教育科技有限公司,6167.7,4317.39,0,25
500379,南京经纶文化传媒有限公司,3729.4,2610.58,0,112
500409,湖北世纪国华文化传播有限公司,7201.3,5040.91,6,121
500343,山东佰鸿壹铭教育科技有限公司,2264,1584.8,0,0
500370,江西铭文文化发展有限公司,4067.3,2847.11,9,338
500490,《数理报》社有限公司,7440.7,3720.35,25,278
500304,洛阳九歌文化传播有限公司,8765.66,6135.96,102,1066
500649,梁山启智教育图书有限公司,1883.5,1318.45,0,123
500365,天津市恒真文化发展有限公司,1003.7,702.59,7,218
500526,山东先德睿图书有限公司,456.9,319.83,0,0
500317,湖北稳派教育科技有限公司,592,414.4,5,66
500363,合肥皖智教育科技集团有限公司,1266.3,886.4,0,0
500327,河南清北之道教育研究院有限公司,114.6,80.22,0,0
500454,湖北金色花开文化有限公司,125.7,87.99,0,0
500300,山东名师文化传媒有限公司,160.6,112.42,0,0
500334,山西唐文文化发展有限公司,577.75,404.4,0,0
500390,河北优盛文化传播有限公司,74.2,51.94,0,0
500332,北京金海豚教育科技有限公司,7,4.9,0,0
800032,京版北教文化传媒股份有限公司,118.9,83.05,0,0
500525,威海天梯图书有限公司,60,42,0,0
500453,福州学熙文化传媒有限公司,47.4,33.18,0,0
500329,河北知灼图书销售有限公司,28.4,19.88,0,0
500360,河南智评教育科技有限公司,92.8,64.96,2,3
500451,山东滨州教与学图书有限公司,6,4.2,0,0
500417,北京组合教育科技有限公司,0,0,0,0
500434,山东智慧翔文化传媒有限公司,6,4.2,0,0
500325,广州领航教育科技有限公司,0,0,0,0
500400,南昌博智文化传播有限公司,8,5.6,0,0
500628,北京引航者教育咨询有限公司,0,0,0,0
500441,陕西巨微图书文化传播有限公司,118.7,59.35,0,0
500414,河南世纪天成文化发展有限公司,2,1.4,0,0
500432,南京智业天成文化传播有限公司,0,0,0,0
500381,广州逆袭教育科技服务有限公司,3,1.5,0,0
500291,文科创新（北京）教育科技有限公司,0,0,0,0
500396,河北动力林图书贸易有限公司,0,0,0,0
500458,湖南高中生杂志社有限责任公司,0,0,0,0
500310,辽宁教育周报出版有限公司,0,0,0,0
500459,安徽优知教育咨询有限公司,0,0,0,0
500308,山东学智文化传媒有限公司,0,0,0,0
500650,陕西紫腾山文化传媒有限公司,0,0,0,0
500625,陕西腾跃教育科技有限公司,0,0,0,0
500420,天津升学易徐师教育咨询中心,0,0,0,0
500436,北京明师国际教育科技有限公司,0,0,0,0
500340,北京龙凤传承国际教育科技有限公司,0,0,0,0
500664,佳木斯市助力电子商务有限公司,0,0,0,0
500566,山东金榜苑文化传媒有限责任公司,12087.19,8460.93,0,0
500553,山东中联翰元教育科技有限公司,948.2,474.1,0,0
500174,山东强联文化传媒有限公司,1533.28,1073.29,0,0
500489,山东本真图书有限公司,942.32,659.62,14,694
500253,郑州天勤图书有限责任公司,4656.3,3259.41,6,246
800001,新蕾出版社（天津）有限公司,41.2,20.6,0,0
500531,河北三品图书有限公司,2,1.4,0,0
500501,泽尚阳光北京教育科技有限公司,0,0,0,0
500495,正定思立方文化传播有限公司,0,0,0,0
500491,北京金榜园教育科技有限公司,0,0,0,0
800008,浙江摄影出版社有限公司,0,0,0,0
500407,成都全德文化传播有限公司,0,0,0,0
500541,山东金考案教育科技有限公司,0,0,0,0
500508,济南东和文化科技有限公司,0,0,0,0
500251,北京京体大文化发展有限公司,0,0,0,0
500567,包头市绿叶风科教文化有限公司,0,0,0,0
500683,贵州用心育才教育信息咨询有限公司,0,0,0,0
500565,北京天才推手教育科技有限公司,0,0,0,0
500507,山东育博苑文化传媒有限公司,8622.1,6035.47,4,70
500538,安徽木牍教育图书有限公司,4291.42,3003.98,11,139
500572,山东金太阳教育集团有限公司,1665.3,1165.71,0,0
500479,山东智乐星教育科技股份有限公司,1791.2,1253.84,0,0
500499,湖北智慧万羽文化传媒有限公司,4224.38,2957.06,0,0
500570,山东百川数字科技有限公司,247.7,123.85,0,0
500464,山东文丰苑图书有限公司,397.5,278.25,0,0
500488,山东旭阳教育科技有限公司,141.8,99.26,0,0
500536,太原市晋文源图书有限公司,25,17.5,0,0
500504,一川教育,40,28,0,0
500473,北京明信弘德文化发展有限公司,5,3.5,0,0
500534,北京时代圣哲教育科技有限公司,4713.6,3299.51,14,255
500311,南京缘溪行文化传播有限公司,67.2,47.04,0,0
500468,广州思脉图书发行有限公司,0,0,0,0
500185,保定市三合图书销售有限公司,0,0,0,0
500469,黑龙江学与考教育信息咨询有限公司,0,0,0,0
500560,河北华翰书业有限公司,0,0,0,0
500512,北京阅来阅好图书有限公司,0,0,0,0
500558,连云港翰秦信息技术有限公司,0,0,0,0
500462,武汉沃德丰教育科技有限公司,6,4.2,0,0
500557,广州卓品文化传播有限公司,1.5,1.05,0,0
500476,晋中市乐学文化咨询有限责任公司,0,0,0,0
500511,忻州市青果教育咨询有限公司,0,0,0,0
500461,北京志高行远教育科技有限公司,0,0,0,0
800033,浙江大学出版社有限责任公司,2,1.4,0,0
500555,贵州艺和教联文化有限公司,0,0,0,0
500548,北京书诚汇发文化发展有限公司,0,0,0,0
500481,西安九宗数码科技有限公司,0,0,0,0
500470,福清智高点教育培训学校有限公司,0,0,0,0
500498,河北天智达图书有限公司,0,0,0,0
500533,《学习报》社有限责任公司,0,0,0,0
500510,北京历说教育科技有限公司,0,0,0,0
500493,中视天之聪教育科技（北京）有限公司,0,0,0,0
500551,河南开祥文化传播有限公司,0,0,0,0
500133,重庆亚太图书出版发行有限公司,0,0,0,0
519731,鑫拓（广州）科技有限公司,4246.92,2972.84,69,477
520221,梁山见山文化传播中心,1993.6,1395.52,21,430
520991,郑州载望图书有限公司,533.4,373.38,0,0
520676,广州市昭阳博悦文化传播有限公司,4668.3,3267.81,3,365
520482,云南自有文化传播有限公司,84.3,679.01,0,0
520481,武汉鑫南泓文化传媒有限公司,250.8,175.56,7,32
521916,淄博汇智图书有限公司,1015.3,710.71,0,0
522276,北京先知时代文化中心,240,168,0,0
